{"accesses":[{"connectionFamilies":["solver-main","snapshot-gc"],"construction":"qualified","identifier":"private.lca_active_snapshots","objectKind":"relation","required":true,"schemaQualified":true,"searchPathDependent":false,"sources":[{"blobSha":"a0bf5206fb799d89717def8f03b939e54659f094","line":4123,"lineSha256":"3cd75be6affcee6d968a3d9505c1c1d2967ad540968056fe90673a387f0d88de","needle":"private.lca_active_snapshots","path":"crates/solver-worker/src/db.rs"},{"blobSha":"0fd328beb353beff59450346326352f7a90946fc","line":480,"lineSha256":"c99850105ffe55d596f495a3f8a45a6f0ad51f3f6242c4c902ec21f8ad926dfc","needle":"private.lca_active_snapshots","path":"crates/solver-worker/src/snapshot_retention.rs"}],"surfaceClass":"production-runtime","verbs":["SELECT","INSERT","UPDATE"]},{"connectionFamilies":["solver-main","snapshot-builder","snapshot-gc"],"construction":"qualified","identifier":"private.lca_network_snapshots","objectKind":"relation","required":true,"schemaQualified":true,"searchPathDependent":false,"sources":[{"blobSha":"a0bf5206fb799d89717def8f03b939e54659f094","line":2974,"lineSha256":"b578e1b2c79754c18bb9027ae19f6bd9de4fd449745f54f87ca063dc71700b3e","needle":"private.lca_network_snapshots","path":"crates/solver-worker/src/db.rs"},{"blobSha":"907b178e5e4aa83f89d7ab7f1d306016474c8b3a","line":6524,"lineSha256":"b578e1b2c79754c18bb9027ae19f6bd9de4fd449745f54f87ca063dc71700b3e","needle":"private.lca_network_snapshots","path":"crates/solver-worker/src/bin/snapshot_builder.rs"},{"blobSha":"0fd328beb353beff59450346326352f7a90946fc","line":498,"lineSha256":"b6b75c7392b95c6c31f2e92eabc0930bad1e3e06cd813c4a30bd131516448e5c","needle":"private.lca_network_snapshots","path":"crates/solver-worker/src/snapshot_retention.rs"}],"surfaceClass":"production-runtime","verbs":["SELECT","INSERT","UPDATE","DELETE"]},{"connectionFamilies":["solver-main","snapshot-builder"],"construction":"qualified","identifier":"private.lca_snapshot_artifacts","objectKind":"relation","required":true,"schemaQualified":true,"searchPathDependent":false,"sources":[{"blobSha":"a0bf5206fb799d89717def8f03b939e54659f094","line":1022,"lineSha256":"f9d3ec9fca36d524bb55949ddd9506bb7dc50e77d702f5f883a7d669e1a3440b","needle":"private.lca_snapshot_artifacts","path":"crates/solver-worker/src/db.rs"},{"blobSha":"907b178e5e4aa83f89d7ab7f1d306016474c8b3a","line":6525,"lineSha256":"2fe8ed604a008a7896d16254f9e59455ea575482855756c524f599d2b7ccd60b","needle":"private.lca_snapshot_artifacts","path":"crates/solver-worker/src/bin/snapshot_builder.rs"},{"blobSha":"e112e429dec9ca117ba2559c69101e88621d9550","line":96,"lineSha256":"dd1e6157d0a552cf23c61f3a881b0ceb910b7b72533927ee7c1bc1f35e1b8d22","needle":"private.lca_snapshot_artifacts","path":"crates/solver-worker/src/queue.rs"}],"surfaceClass":"production-runtime","verbs":["SELECT","INSERT","UPDATE"]},{"connectionFamilies":["solver-main","maintenance-worker"],"construction":"qualified","identifier":"private.worker_job_artifacts","objectKind":"relation","required":true,"schemaQualified":true,"searchPathDependent":false,"sources":[{"blobSha":"a0bf5206fb799d89717def8f03b939e54659f094","line":53,"lineSha256":"be460e4135a1381a3b7076fa455dbe2b745e37ca234bf7c1af9d2f59069ab715","needle":"worker_job_artifacts","path":"crates/solver-worker/src/db.rs"},{"blobSha":"c28492e6bafee47a34be46a6c01bb95365c9864e","line":42,"lineSha256":"75417c00dd8f61cf91ba0e96ff9e159c19ac0979de2f1025b8695a8f28b76a63","needle":"worker_job_artifacts","path":"crates/solver-worker/src/scope_closure.rs"},{"blobSha":"8638ae91482bb3baca94de3c1d66075c19ad50d8","line":21,"lineSha256":"32b3dc5e5f5b91af548e7d5a6212aa0a9109dbce9f15f524302d14055b58df79","needle":"private.worker_job_artifacts","path":"crates/solver-worker/src/worker_control_plane.rs"}],"surfaceClass":"production-runtime","verbs":["SELECT","INSERT"]},{"connectionFamilies":["solver-main","package-main","review-submit-main","result-gc"],"construction":"qualified","identifier":"private.worker_jobs","objectKind":"relation","required":true,"schemaQualified":true,"searchPathDependent":false,"sources":[{"blobSha":"a0bf5206fb799d89717def8f03b939e54659f094","line":53,"lineSha256":"be460e4135a1381a3b7076fa455dbe2b745e37ca234bf7c1af9d2f59069ab715","needle":"worker_jobs","path":"crates/solver-worker/src/db.rs"},{"blobSha":"e112e429dec9ca117ba2559c69101e88621d9550","line":17,"lineSha256":"7b72ddc56e9e40da0c7fd00c5d4d5b5932a1714dce4236e30e8ab043cfcc662a","needle":"worker_jobs","path":"crates/solver-worker/src/queue.rs"},{"blobSha":"a8a43617b0845dff6d3669e555e1b1fdba26ad02","line":32,"lineSha256":"a95557ee5ebe5e828df2c4442ce9702f0781ec557c3562cd5824d6998be785df","needle":"worker_jobs","path":"crates/solver-worker/src/package_execution.rs"},{"blobSha":"8638ae91482bb3baca94de3c1d66075c19ad50d8","line":11,"lineSha256":"43d97c740f63c52ce6e0574188ce484b1ba53e83d9268880d966b88f5fb813ec","needle":"private.worker_jobs","path":"crates/solver-worker/src/worker_control_plane.rs"}],"surfaceClass":"production-runtime","verbs":["SELECT","UPDATE"]},{"connectionFamilies":["snapshot-builder","package-main","solver-main"],"construction":"mixed","identifier":"public.contacts","objectKind":"relation","required":true,"schemaQualified":false,"searchPathDependent":true,"sources":[{"blobSha":"907b178e5e4aa83f89d7ab7f1d306016474c8b3a","line":7261,"lineSha256":"16fdefe9f7225214b773738c24b9937ecd73d0fedc6f35f389babc9bfaf6d083","needle":"public.contacts","path":"crates/solver-worker/src/bin/snapshot_builder.rs"},{"blobSha":"a8a43617b0845dff6d3669e555e1b1fdba26ad02","line":2525,"lineSha256":"22553421e9c1245f0847257817b7c52389ce82653da68e1de0b52064c8823bba","needle":"contacts","path":"crates/solver-worker/src/package_execution.rs"},{"blobSha":"c28492e6bafee47a34be46a6c01bb95365c9864e","line":206,"lineSha256":"4606b382b96ffc435132624728d92cd4574002913525ee97d40ac243731a5146","needle":"contacts","path":"crates/solver-worker/src/scope_closure.rs"}],"surfaceClass":"production-runtime","verbs":["SELECT","INSERT"]},{"connectionFamilies":["review-submit-main"],"construction":"qualified","identifier":"public.dataset_review_submit_gate_runs","objectKind":"relation","required":true,"schemaQualified":true,"searchPathDependent":false,"sources":[{"blobSha":"bbfd4aa06ef6bd6fea281b486b16cce2026ea8da","line":559,"lineSha256":"90ff4ab2ce45fbad541b764d9e4104b6eaf8739b444b0c1bcedded5cb327b246","needle":"public.dataset_review_submit_gate_runs","path":"crates/solver-worker/src/review_submit_gate_runner.rs"}],"surfaceClass":"production-runtime","verbs":["SELECT","UPDATE"]},{"connectionFamilies":["snapshot-builder","package-main","solver-main"],"construction":"mixed","identifier":"public.flowproperties","objectKind":"relation","required":true,"schemaQualified":false,"searchPathDependent":true,"sources":[{"blobSha":"907b178e5e4aa83f89d7ab7f1d306016474c8b3a","line":7264,"lineSha256":"535654ec5fd05b89a5a6d558850d3175fb91e9437eac3c69b833d9fa6984ad4a","needle":"public.flowproperties","path":"crates/solver-worker/src/bin/snapshot_builder.rs"},{"blobSha":"a8a43617b0845dff6d3669e555e1b1fdba26ad02","line":2570,"lineSha256":"3d66b5e87cd1c5c1da753f51dbe5bd0e4933f3fc5324f95e806878697b23b930","needle":"flowproperties","path":"crates/solver-worker/src/package_execution.rs"},{"blobSha":"c28492e6bafee47a34be46a6c01bb95365c9864e","line":207,"lineSha256":"b2edcfae8e93eb2f41ac5464132908eecb1615fafb562531d8d0f1371de3d4fb","needle":"flowproperties","path":"crates/solver-worker/src/scope_closure.rs"}],"surfaceClass":"production-runtime","verbs":["SELECT","INSERT"]},{"connectionFamilies":["snapshot-builder","package-main","solver-main","process-flow-graph"],"construction":"mixed","identifier":"public.flows","objectKind":"relation","required":true,"schemaQualified":false,"searchPathDependent":true,"sources":[{"blobSha":"907b178e5e4aa83f89d7ab7f1d306016474c8b3a","line":6441,"lineSha256":"2ecb2484e85125a5e495af0d56f672fce168735c352203ca3e63e6257d180a5b","needle":"public.flows","path":"crates/solver-worker/src/bin/snapshot_builder.rs"},{"blobSha":"a8a43617b0845dff6d3669e555e1b1fdba26ad02","line":2585,"lineSha256":"5e826bf35c5e55337cc2886103173ae9a73d625c650fac2110964f7caf68f81a","needle":"flows","path":"crates/solver-worker/src/package_execution.rs"},{"blobSha":"c28492e6bafee47a34be46a6c01bb95365c9864e","line":208,"lineSha256":"3ccbfffd5d27a2c8f8bd3cd0b53a1f21a8bbd7c2a44f76623e47212a589587af","needle":"flows","path":"crates/solver-worker/src/scope_closure.rs"},{"blobSha":"eaf0347c08f7fc49e1e3ba014d263b5ea0544acf","line":111,"lineSha256":"4a8389936ebc5a267d1c75c69fded9d805f5b52a62d9ec06345b77651839773b","needle":"flows","path":"crates/solver-worker/src/bin/process_flow_graph_cache_builder.rs"}],"surfaceClass":"production-runtime","verbs":["SELECT","INSERT"]},{"connectionFamilies":["solver-main"],"construction":"search_path","identifier":"public.lca_biosphere_entries","objectKind":"relation","required":true,"schemaQualified":false,"searchPathDependent":true,"sources":[{"blobSha":"a0bf5206fb799d89717def8f03b939e54659f094","line":987,"lineSha256":"e34305053cce939df07f52da4b2806ba5d7f39fcf5033e49bf937e2b628849c0","needle":"lca_biosphere_entries","path":"crates/solver-worker/src/db.rs"}],"surfaceClass":"production-runtime","verbs":["SELECT"]},{"connectionFamilies":["solver-main"],"construction":"search_path","identifier":"public.lca_characterization_factors","objectKind":"relation","required":true,"schemaQualified":false,"searchPathDependent":true,"sources":[{"blobSha":"a0bf5206fb799d89717def8f03b939e54659f094","line":998,"lineSha256":"0197898cf6eec75791cc3f3133a262096bff0b3fd3fc541b19ec16c3b276c829","needle":"lca_characterization_factors","path":"crates/solver-worker/src/db.rs"}],"surfaceClass":"production-runtime","verbs":["SELECT"]},{"connectionFamilies":["solver-main"],"construction":"qualified","identifier":"public.lca_factorization_registry","objectKind":"relation","required":true,"schemaQualified":true,"searchPathDependent":false,"sources":[{"blobSha":"e112e429dec9ca117ba2559c69101e88621d9550","